"SampleName","File","Directory","FilePath","Success","Issues","Title"
"Sample-82","Sample-82.json","math","C:\Repos\Private\Jlio-online\Client\wwwroot\samples\functions\math\Sample-82.json","False","Missing input properties: weather","Min and Max calculations"
"Sample-83","Sample-83.json","math","C:\Repos\Private\Jlio-online\Client\wwwroot\samples\functions\math\Sample-83.json","False","Missing input properties: data","Absolute value and rounding functions"
"Sample-84","Sample-84.json","text","C:\Repos\Private\Jlio-online\Client\wwwroot\samples\functions\text\Sample-84.json","False","Missing input properties: data","Substring and trim text functions"
"Sample-85","Sample-85.json","text","C:\Repos\Private\Jlio-online\Client\wwwroot\samples\functions\text\Sample-85.json","False","Missing input properties: user","Text case conversion functions"
"Sample-86","Sample-86.json","text","C:\Repos\Private\Jlio-online\Client\wwwroot\samples\functions\text\Sample-86.json","False","Missing input properties: data","Replace and pad text functions"
"Sample-87","Sample-87.json","text","C:\Repos\Private\Jlio-online\Client\wwwroot\samples\functions\text\Sample-87.json","False","Missing input properties: file","Left and right string extraction"
"Sample-88","Sample-88.json","text","C:\Repos\Private\Jlio-online\Client\wwwroot\samples\functions\text\Sample-88.json","False","Missing input properties: credentials","Text length and contains validation"
"Sample-89","Sample-89.json","text","C:\Repos\Private\Jlio-online\Client\wwwroot\samples\functions\text\Sample-89.json","False","Missing input properties: data","Insert and delete text operations"
"Sample-9","Sample-9.json","set","C:\Repos\Private\Jlio-online\Client\wwwroot\samples\commands\set\Sample-9.json","False","Missing input properties: sample","Set a property value to an array"
"Sample-96","Sample-96.json","put","C:\Repos\Private\Jlio-online\Client\wwwroot\samples\commands\put\Sample-96.json","False","Missing input properties: record","Put nested object structure"
"Sample-97","Sample-97.json","put","C:\Repos\Private\Jlio-online\Client\wwwroot\samples\commands\put\Sample-97.json","False","Missing input properties: project","Put array property"
"Sample-98","Sample-98.json","put","C:\Repos\Private\Jlio-online\Client\wwwroot\samples\commands\put\Sample-98.json","False","Missing input properties: counter","Put conditional status value"
"Sample-99","Sample-99.json","remove","C:\Repos\Private\Jlio-online\Client\wwwroot\samples\commands\remove\Sample-99.json","False","Missing input properties: obj","Remove nested object"
